{"chunk":"c4","reviews":[{"topic_id":"c4-T01","verdict":"accept","reason":"원문 대조 결과 시안 1안 선택에 참여자 3인의 의견 표명과 담당자C의 확정 발언이 모두 존재하며, status 해결·결정·owner 담당자C가 근거와 일치합니다. 선택 시점에는 장소 미확정이라 인쇄는 뒤로 미뤄졌는데 analyst도 이를 T03과 분리해 다루어 결정과 이행을 혼동하지 않았습니다.","evidence":[{"line":"L00094","quote":"저도 첫 번째에 한 표입니다."},{"line":"L00095","quote":"첫 번째가 나아 보입니다."},{"line":"L00096","quote":"그럼 첫 번째로 진행하겠습니다. 장소 확정되면 넣고 인쇄 맡길게요."}],"proposed_change":null,"assumptions":[],"counter_evidence":[],"unknowns":[]},{"topic_id":"c4-T02","verdict":"accept","reason":"10월 8일 미승인 → 10월 9일 승인·일시 확정의 시간순 변화가 원문 그대로이고, 최신 발언(L00109)이 이전 상태를 갱신한 점을 정확히 반영했습니다. 확정 일시 10월 24일 13:00~17:00도 원문과 일치합니다.","evidence":[{"line":"L00104","quote":"소강당 승인 아직 안 났습니다. 내일쯤 나올 것 같아요."},{"line":"L00109","quote":"소강당 승인 났습니다. 10월 24일 오후 1시부터 5시까지 확정입니다."}],"proposed_change":null,"assumptions":[],"counter_evidence":[],"unknowns":[]},{"topic_id":"c4-T03","verdict":"accept","reason":"수량 100장 결정(L00113)과 실제 발주 보고(L00120)가 모두 원문에 있어 결정+이행이 확인되므로 해결·결정이 타당합니다. 다만 '다음 주 화요일'이라는 구체 시점이 본문에 있는데 deadline이 null인 점은 next_check로만 처리돼 있어, 원한다면 deadline에 '인쇄물 수령: 다음 주 화요일'을 기입하는 편이 더 정확합니다(결론 자체를 바꾸는 지적은 아님).","evidence":[{"line":"L00113","quote":"할인 받으려면 100장 이상이어야 하니 100장으로 하겠습니다."},{"line":"L00120","quote":"인쇄소에 100장 주문했습니다. 다음 주 화요일에 나온다고 합니다."}],"proposed_change":null,"assumptions":[],"counter_evidence":[],"unknowns":["인쇄물 실제 수령 여부는 이 청크 범위(10/9 종료) 밖"]},{"topic_id":"c4-T04","verdict":"revise","reason":"status가 '해결·결정'인데 conclusion 자체가 '실제 반영 확인 발언은 이 구간에 없음'이라고 인정하여 내부 모순입니다. 안건 제목이 '전달 및 홍보물 반영'이므로 반영이 안건의 일부인데, 담당자C는 '반영하겠습니다'라는 의사표시만 했을 뿐입니다. 더욱이 인쇄 발주 직전 발언(L00111)은 '장소랑 시간'만 언급하고 강사 소개 반영은 언급하지 않으며, 발주 보고(L00120)에도 반영 확인이 없어 담당 지정 단계에 머뭅니다. 담당 지정과 완료의 혼동에 해당합니다.","evidence":[{"line":"L00099","quote":"받았습니다. 반영하겠습니다."},{"line":"L00111","quote":"그럼 홍보물에 장소랑 시간 넣고 인쇄 맡기겠습니다."},{"line":"L00120","quote":"인쇄소에 100장 주문했습니다. 다음 주 화요일에 나온다고 합니다."}],"proposed_change":"status를 '해결·결정' → '담당 지정'으로 변경(owner 담당자C 유지). conclusion을 '참여자D가 강사 소개를 전달했고 담당자C가 수령 확인 후 반영하겠다고 답함. 다만 인쇄 발주 시점(L00111·L00120)까지 강사 소개 반영 여부를 확인하는 발언은 없어 이행은 미확인'으로 수정. 분리를 원하면 '자료 전달(완료)'과 '홍보물 반영(담당 지정)'을 별도 안건으로 나눌 것.","assumptions":[],"counter_evidence":[{"line":"L00098","quote":"강사분 소개 정리해서 담당자C님께 보냈습니다."}],"unknowns":["인쇄본에 강사 소개가 실제 반영됐는지는 이 청크 범위 밖(다음 주 수령 시점)"]},{"topic_id":"c4-T05","verdict":"accept","reason":"제목이 '발표 순서 결정 시점'으로 한정돼 있고, 연기 자체에 대해 제안(L00100)과 명시적 동의(L00101)가 모두 있어 '시점 합의'는 실제로 결정됐습니다. conclusion에서 '순서 자체는 아직 미정'을 명시해 결정과 이행을 구분한 점도 적절합니다.","evidence":[{"line":"L00100","quote":"발표 순서도 정해야 하는데 신청 받고 나서 정할까요?"},{"line":"L00101","quote":"네 그게 나을 것 같습니다."}],"proposed_change":null,"assumptions":[],"counter_evidence":[],"unknowns":["신청 마감 후 발표 순서를 실제로 정했는지는 이 청크 범위 밖"]},{"topic_id":"c4-T06","verdict":"revise","reason":"제목이 '뒤풀이 장소 예약'(행위 자체)인데 status가 '해결·결정'이어서 안건이 종결된 것처럼 읽힙니다. 원문은 참여자D의 제안에 진행자A가 '그때 알아봅시다'라고 미룬 것이 전부이고, T05와 달리 제안자의 수용 발언도, 담당자도, 트리거('인원 확정')의 기준 시점도 없습니다. conclusion도 '예약 행위는 보류 상태'라고 스스로 적고 있어 status와 어긋납니다.","evidence":[{"line":"L00102","quote":"뒤풀이 장소도 미리 예약해둘까요?"},{"line":"L00103","quote":"인원이 확정되면 그때 알아봅시다."}],"proposed_change":"status를 '해결·결정' → '진행 중'으로 변경(owner null 유지). conclusion을 '사전 예약 제안에 대해 인원 확정 후 알아보기로 미뤘을 뿐, 담당자·기준 시점·예약 여부는 미정'으로 수정. 대안으로 제목을 '뒤풀이 장소 예약 시점 연기'로 한정한다면 해결·결정 유지도 가능하나, 그 경우 owner 부재와 재개 트리거 미정을 unknowns에 남길 것.","assumptions":[],"counter_evidence":[{"line":"L00103","quote":"인원이 확정되면 그때 알아봅시다."}],"unknowns":["'인원 확정'의 기준(입금 마감 10/17인지 별도 시점인지) 미명시","이후 뒤풀이 논의 재개 여부는 이 청크 범위 밖"]},{"topic_id":"c4-T07","verdict":"accept","reason":"기한 유지(10월 17일 금요일 '그대로')와 공지 담당(참여자D)이 원문과 일치하고, 공지 이행 보고가 없다는 점을 근거로 '담당 지정'을 택한 것이 타당합니다. deadline 값도 '10월 17일 금요일(입금 마감)'이라고 괄호로 성격을 밝혀 공지 기한과 혼동되지 않게 했습니다. 기한 변경이 아니라 유지 확인이라는 점도 정확합니다.","evidence":[{"line":"L00115","quote":"장소가 확정됐으니 입금 마감도 다시 확인합시다. 10월 17일 금요일 그대로 갑니다."},{"line":"L00116","quote":"네 공지하겠습니다."}],"proposed_change":null,"assumptions":[],"counter_evidence":[],"unknowns":["이전 청크에서 10월 17일이 처음 정해진 경위 및 변경 이력은 이 청크 밖","공지 실제 발송 여부 미확인"]},{"topic_id":"c4-T08","verdict":"accept","reason":"제기된 의문(L00117)에 대해 진행자A의 근거 있는 유지 결정(L00118)과 질문자의 수용(L00119)이 모두 있어 '답 없는 질문'이 아니며 해결·결정이 맞습니다.","evidence":[{"line":"L00117","quote":"그런데 참가비 1만 원은 확정인가요? 작년보다 두 배라 문의가 있을 것 같아서요."},{"line":"L00118","quote":"간식이랑 자료집 생각하면 1만 원도 빠듯합니다. 그대로 가죠."},{"line":"L00119","quote":"알겠습니다."}],"proposed_change":null,"assumptions":[],"counter_evidence":[],"unknowns":[]},{"topic_id":"c4-T09","verdict":"accept","reason":"금액·기한·주체가 원문에 명시돼 있고, 입금 실행 보고가 없으므로 '담당 지정'과 deadline 10월 21일이 정확합니다. 행사일 10월 24일 기준 '3일 전'과 10월 21일도 정합적이며 담당자B가 이를 확인했습니다.","evidence":[{"line":"L00123","quote":"행사 3일 전까지라고 하셨죠? 제가 10월 21일에 입금하겠습니다."},{"line":"L00124","quote":"네 맞습니다."}],"proposed_change":null,"assumptions":[],"counter_evidence":[],"unknowns":["10월 21일 입금 실행 여부는 이 청크 범위 밖"]},{"topic_id":"c4-T10","verdict":"accept","reason":"12명 접수·정원 50명은 원문 그대로이고 상태값 '정보공유'도 허용값 내에서 적절합니다. '계속 홍보합시다'는 구체 담당·기한이 없는 독려 수준이라 별도 결정 안건으로 올리지 않은 판단도 무리가 없습니다.","evidence":[{"line":"L00125","quote":"신청 폼 열어두었더니 벌써 12명 신청했습니다."},{"line":"L00126","quote":"좋네요. 50명까지 받을 수 있으니 계속 홍보합시다."}],"proposed_change":null,"assumptions":[],"counter_evidence":[],"unknowns":["정원 50명이 어디서 정해졌는지는 이 청크 밖"]},{"topic_id":"c4-T11","verdict":"accept","reason":"담당자C의 자발적 담당 선언과 진행자A의 수락만 있고 부착 이행은 인쇄물 수령 이후이므로 '담당 지정'이 정확합니다. 완료로 격상하지 않은 점이 적절합니다.","evidence":[{"line":"L00127","quote":"포스터 나오면 게시판이랑 강의실에 붙이겠습니다."},{"line":"L00128","quote":"네 부탁드려요."}],"proposed_change":null,"assumptions":[],"counter_evidence":[],"unknowns":["부착 이행 여부는 이 청크 범위 밖"]},{"topic_id":"c4-T12","verdict":"accept","reason":"10월 8일 질문(L00106)이 '오늘은 여기까지'로 답 없이 넘어간 뒤 10월 9일 재제기됐고, 담당자C가 고사하고 진행자A가 방향만 제시한 채 주간이 종료된 경위가 정확히 기술됐습니다. owner를 null로 두고 담당자를 임의 지정하지 않은 점, 재제기가 있었으므로 '흐지부지'가 아닌 '진행 중'으로 본 점 모두 근거와 부합합니다.","evidence":[{"line":"L00106","quote":"혹시 행사 사진 찍을 분은 정하셨나요?"},{"line":"L00129","quote":"사진 찍을 분은 아직 안 정해졌죠?"},{"line":"L00130","quote":"제가 카메라는 있는데 발표도 해야 해서 어려울 것 같아요."},{"line":"L00131","quote":"그럼 신청자 중에 부탁해보는 것도 방법이겠네요."}],"proposed_change":null,"assumptions":[],"counter_evidence":[{"line":"L00107","quote":"오늘은 여기까지 하겠습니다."}],"unknowns":["'신청자 중에 부탁' 안을 누가 실행할지 미지정 — 다음 주 대화 확인 필요"]}],"missing_topics":[],"overall":"12개 안건이 L00091~L00132를 빠짐없이 덮고 있고, 인용은 모두 해당 줄의 실제 부분 문자열이며 의미상으로도 결론을 뒷받침합니다. 누락 안건은 없습니다. 다만 상태값 배정에서 두 건이 과대평가돼 있습니다. c4-T04(강사 소개 전달 및 반영)는 '반영하겠습니다'라는 의사표시뿐이고 인쇄 발주 발언(L00111·L00120)에도 반영 확인이 없는데 해결·결정으로 분류돼 담당 지정과 완료를 혼동했습니다. c4-T06(뒤풀이 장소 예약)은 담당자·기준 시점 없는 무기한 보류인데 해결·결정으로 분류돼 conclusion의 '보류 상태'와 모순됩니다. 두 건 모두 conclusion 본문에는 미이행·보류가 적혀 있어 status만 조정하면 됩니다. 반대로 c4-T12(사진 촬영 담당자)는 답 없는 질문과 고사 경위를 정확히 추적했고, c4-T07·T09는 담당 지정 단계로 올바르게 남겼으며, c4-T02의 최신 발언 반영(미승인→승인)과 c4-T07의 기한 유지(변경 아님) 판단도 정확합니다. 사람 확인 질문: (1) c4-T06의 '인원 확정' 트리거를 입금 마감 10월 17일로 간주해도 되는지, (2) c4-T04를 '자료 전달'과 '홍보물 반영'으로 분리 관리할지 한 안건으로 둘지."}
