{"chunk":"c1","reviews":[{"topic_id":"c1-T01","verdict":"accept","reason":"원문 대조 결과 결정(L00018)과 이행(L00022)이 모두 명시되어 있어 '해결·결정' 판정이 타당합니다. 예약 취소·변경 발언은 이 청크에 없고, 담당자B가 스스로 예약 완료를 보고했으므로 '담당 지정'과 '완료'의 혼동도 없습니다. 대관료 납부 여부를 이행에 포함시키지 않고 unknowns로 분리한 점도 적절합니다.","evidence":[{"line":"L00018","quote":"그럼 10월 24일로 확정합시다"},{"line":"L00020","quote":"예약 진행해주세요"},{"line":"L00022","quote":"대강당 예약 완료했습니다"}],"proposed_change":null,"assumptions":[],"counter_evidence":[],"unknowns":["이후 청크에서 예약 취소·일정 변경, 대관료 30만 원 및 보증금 10만 원 실제 납부 언급이 있는지"]},{"topic_id":"c1-T02","verdict":"revise","reason":"담당 지정 판정과 미제출 상태 기술은 원문과 일치하지만, deadline 처리가 불충분합니다. 분석자는 '이번 주 금요일'의 구체 날짜가 대화에 없다고 했으나, 대화 날짜 구분선 L00004가 2026년 10월 5일 월요일임을 명시하므로 같은 주 금요일은 10월 9일로 특정됩니다. 기한 추적이 목적인 항목에서 날짜를 비워두면 이후 청크에서 지연 여부를 판단할 수 없습니다.","evidence":[{"line":"L00004","quote":"2026년 10월 5일 월요일"},{"line":"L00012","quote":"이번 주 금요일까지 시안 두 개 만들어오겠습니다"},{"line":"L00011","quote":"부탁드려요. 초안은 언제쯤 볼 수 있을까요?"}],"proposed_change":"deadline을 \"이번 주 금요일\" 대신 \"2026-10-09(금) — L00004의 날짜 구분선 기준으로 산출한 값, 원문에 날짜 자체가 적힌 것은 아님\"으로 기재하고, unknowns의 '구체적 날짜 미명시' 항목은 '진행자A가 이 날짜를 명시적으로 확인·합의한 발언은 없음'으로 바꾸세요. status(담당 지정)와 owner(담당자C)는 그대로 둡니다.","assumptions":["L00004의 날짜 구분선이 이후 메시지들의 발화일을 가리킨다고 봄"],"counter_evidence":[],"unknowns":["담당자C가 말한 '이번 주'가 발화일 주간을 뜻하는지 이후 청크에서 재확인되는지"]},{"topic_id":"c1-T03","verdict":"revise","reason":"참가비 1만 원 인상 결정은 원문과 일치합니다. 그러나 최종 기한 기재에 원문 자체의 모순이 있는데 분석자가 이를 그대로 옮겼습니다. L00017에서 10월 24일이 토요일로 확인되므로 그 일주일 전인 10월 17일 역시 토요일이며, L00023의 '10월 17일 금요일'은 날짜와 요일이 서로 어긋납니다. 마감이 10월 17일(토)인지 10월 16일(금)인지 확정할 수 없으므로 deadline을 단정해서는 안 됩니다.","evidence":[{"line":"L00016","quote":"발표회 일주일 전까지로 하죠"},{"line":"L00017","quote":"10월 24일 토요일만 비어 있다고 합니다"},{"line":"L00023","quote":"입금 마감은 10월 17일 금요일로 하겠습니다"}],"proposed_change":"deadline을 \"10월 17일 금요일\"에서 \"10월 17일(단, 원문 표기 '금요일'과 불일치 — L00017 기준 10월 24일이 토요일이므로 10월 17일은 토요일. 10월 16일(금) 또는 10월 17일(토) 중 확정 필요)\"로 수정하고, certainty를 '확정'에서 한 단계 낮추세요. unknowns에 '마감일의 날짜/요일 표기 불일치'를 추가하고, 사람에게 확인할 질문으로 '입금 마감을 10월 16일 금요일로 볼지 10월 17일 토요일로 볼지'를 남기세요. status(해결·결정)와 참가비 1만 원 결론은 유지합니다.","assumptions":[],"counter_evidence":[{"line":"L00023","quote":"10월 17일 금요일로 하겠습니다"}],"unknowns":["이후 청크에서 마감일이 재확인·정정되는지","참가비 인상 및 마감일을 회원에게 공지한 주체·방법"]},{"topic_id":"c1-T04","verdict":"revise","reason":"진행자A가 문의 의사를 밝힌 것은 맞으나 원문은 '여쭤볼까 하는데'라는 미확정 의향이고, 누가 언제까지 연락한다는 지정·확약이 없습니다. status '담당 지정'은 수용 가능하지만 certainty '확정'은 과합니다. 또한 참여자D의 '연락처 드릴까요?'는 조건부 보류로만 응답되어 연락처 전달 여부가 미결로 남아 있는데 결론 문장에서 이 미결성이 약하게 표현되었습니다.","evidence":[{"line":"L00025","quote":"작년에 오셨던 분께 다시 여쭤볼까 하는데, 일정이 될지 모르겠네요"},{"line":"L00026","quote":"제가 아는 분 중에도 괜찮은 분 계신데 연락처 드릴까요?"},{"line":"L00027","quote":"일단 작년 분께 먼저 여쭤보고 안 되면 부탁드릴게요"}],"proposed_change":"certainty를 '확정'에서 낮추고(예: 추정), conclusion에 '진행자A의 연락은 확약이 아니라 의향 표명이며(L00025), 연락 기한이 없어 흐지부지 위험이 있음. 참여자D의 지인 연락처 전달 여부는 작년 강사 회신 결과에 종속된 미결 사항'을 명시하세요. owner는 진행자A로 유지하되 '자발적 의향에 근거한 잠정 담당'임을 덧붙이세요.","assumptions":[],"counter_evidence":[],"unknowns":["작년 강사에게 실제로 연락했는지, 회신이 있었는지(이후 청크)","강사 섭외 마감 시한이 어디선가 정해지는지"]},{"topic_id":"c1-T05","verdict":"accept","reason":"참여자D의 정보 공유(L00031~L00032)와 담당자C의 조건부 수행 의사(L00033)가 원문 그대로 반영되었고, 발주 이행은 확인되지 않았다고 명시해 결정과 이행을 혼동하지 않았습니다. 예산 승인·수량이 unknowns로 분리된 점도 적절합니다. 다만 담당자C의 발언은 '시안이 나오면'이라는 선행 조건이 붙어 c1-T02에 종속되므로, 이 종속 관계만 conclusion에 드러나면 더 좋습니다(판정 변경 사유는 아님).","evidence":[{"line":"L00031","quote":"학교 앞 인쇄소가 이번 달에 할인 행사 한다고 합니다"},{"line":"L00033","quote":"시안 나오면 거기 맡겨보겠습니다"}],"proposed_change":null,"assumptions":[],"counter_evidence":[],"unknowns":["할인 행사 종료일과 시안 완성 시점(10월 9일 추정)의 선후 관계","인쇄 비용 지출에 대한 진행자A의 승인 여부"]}],"missing_topics":[],"overall":"5개 안건 중 2건(c1-T01, c1-T05) accept, 3건 revise입니다. 핵심 지적은 c1-T03의 최종 기한으로, L00017의 '10월 24일 토요일'과 L00023의 '10월 17일 금요일'이 요일상 양립할 수 없어 마감일이 10월 16일(금)인지 10월 17일(토)인지 확정 불가인데 분석자가 이를 확정으로 기재했습니다. c1-T02는 L00004 날짜 구분선으로 '이번 주 금요일'이 10월 9일로 특정되므로 기한을 비워둘 필요가 없고, c1-T04는 '여쭤볼까 하는데' 수준의 의향을 certainty 확정으로 올린 점이 과합니다. 상태값은 모두 허용값(해결·결정/담당 지정) 범위 안이며 unresolved를 완료로 격상하거나 원문에 없는 담당자를 지정한 사례는 없습니다. 이 청크에서 누락된 안건은 발견되지 않았습니다. 사람 확인 요청: 입금 마감을 10월 16일 금요일로 볼지 10월 17일 토요일로 볼지."}
