{"chunk":"c2","reviews":[{"topic_id":"c2-T01","verdict":"accept","reason":"원문 대조 결과 취소 통보(L00037), 보증금 전액 환불 약속(L00039), 진행자A의 수용(L00040)이 모두 확인됩니다. 취소는 외부 통보를 수용한 사안이므로 '해결·결정' 분류가 타당하고, 환불이 '약속' 단계일 뿐 이행이 확인되지 않았다는 점을 분석자가 unknowns와 next_check에 이미 분리해 두어 결정과 이행을 혼동하지 않았습니다. owner/deadline을 null로 둔 것도 원문에 근거가 없어 적절합니다.","evidence":[{"line":"L00037","quote":"대강당 예약을 취소해야 한다고 합니다"},{"line":"L00039","quote":"보증금은 전액 환불해준다고 합니다"},{"line":"L00040","quote":"어쩔 수 없죠. 다른 장소를 다시 찾아야겠네요."}],"proposed_change":null,"assumptions":[],"counter_evidence":[{"line":"L00038","quote":"어제 예약 확정했는데 하루 만에 취소인가요?"}],"unknowns":["보증금 환불의 실제 입금 여부는 이 청크 밖에서 확인 필요","취소 사유가 서면으로 확정 통보됐는지는 원문에 없음"]},{"topic_id":"c2-T02","verdict":"accept","reason":"L00041에서 진행자A가 '장소 담당을 다시 정하지 않겠다'고 한 문장을 분석자가 '담당 미지정'과 '본인 직접 수행'으로 정확히 구분해 서술했고, 담당자B의 소강당 확인 수락(L00051)만 실제 업무 수락으로 처리했습니다. 결과 보고가 없다는 점도 명시되어 담당 지정과 완료를 혼동하지 않았습니다. 다만 owner 문자열이 '진행자A(직접 물색)'로 적혀 있어 공식 장소 담당자가 지정되지 않았다는 사실이 필드만 보면 가려질 수 있으므로 counter_evidence에 남깁니다.","evidence":[{"line":"L00041","quote":"장소 담당은 일단 다시 정하지 않겠습니다. 제가 직접 몇 군데 알아볼게요."},{"line":"L00049","quote":"가상문화센터 소강당이 있는데 거기도 알아볼까요?"},{"line":"L00050","quote":"수용 인원이 50명은 되어야 합니다"},{"line":"L00051","quote":"확인해보겠습니다."}],"proposed_change":null,"assumptions":[],"counter_evidence":[{"line":"L00041","quote":"장소 담당은 일단 다시 정하지 않겠습니다"}],"unknowns":["가상문화센터 소강당의 수용 인원·가용 일자 회신 결과","진행자A가 직접 알아본 후보지 결과","대체 장소 확정 기한이 있는지(원문에 없음)"]},{"topic_id":"c2-T03","verdict":"revise","reason":"내용 판단(공란 제작 결정 + 담당자C의 금요일 시안 제출 약속, 이행 미확인)은 원문과 일치해 타당합니다. 다만 unknowns의 '금요일의 구체적 날짜는 원문에 명시되지 않음'은 이 청크 안에서 해소 가능합니다. L00035 날짜 구분선이 '2026년 10월 6일 화요일'이므로 같은 날 발화된 '금요일'은 2026-10-09로 특정됩니다. deadline이 모호하게 남으면 후속 청크에서 미이행 판정 기준이 흔들립니다. 또 L00044의 '예정대로'는 이 금요일 기한이 이 청크 이전에 이미 합의됐음을 시사하므로 최초 설정 근거는 청크 밖 확인 대상입니다.","evidence":[{"line":"L00035","quote":"2026년 10월 6일 화요일"},{"line":"L00043","quote":"네 날짜랑 장소 칸은 비워두세요. 확정되면 바로 채워넣죠."},{"line":"L00044","quote":"그럼 시안은 예정대로 금요일에 드릴게요."}],"proposed_change":"deadline을 '금요일' 대신 '금요일(2026-10-09, L00035 날짜 구분선 기준)'로 구체화하고, unknowns에서 '금요일의 구체적 날짜는 원문에 명시되지 않음'을 삭제한 뒤 '금요일 기한이 이 청크 이전에 언제 어떻게 설정됐는지(L00044 \"예정대로\")는 앞 청크 확인 필요'로 교체. status(담당 지정)·owner(담당자C)·conclusion은 그대로 유지.","assumptions":["L00035의 날짜 구분선이 L00044 발화일에 적용된다고 봄(같은 날짜 블록 내 발화)"],"counter_evidence":[],"unknowns":["시안의 실제 제출 여부는 이후 청크에서 확인 필요","'예정대로'가 가리키는 이전 합의 시점"]},{"topic_id":"c2-T04","verdict":"revise","reason":"결정 내용 자체는 원문과 맞지만 certainty '확정'이 원문 표현과 충돌합니다. L00047은 '최대한 24일 유지하려고 합니다'와 '입금 마감은 일단 그대로 두죠'로, 두 항목 모두 장소 확정 여부에 종속된 잠정 유지입니다. 분석자도 같은 문구를 counter_evidence에 넣어 놓고 certainty는 확정으로 두어 내부 모순이 있습니다. 입금 마감 10월 17일은 이미 외부 공지된 기한(L00046)이라 잠정 유지가 뒤집히면 대외 신뢰 문제로 번질 수 있어, 확정으로 기록하면 후속 청크에서 기한 변경을 '번복'이 아닌 '신규 결정'으로 오판할 위험이 있습니다.","evidence":[{"line":"L00045","quote":"장소 못 구하면 발표회 날짜도 바뀌는 건가요?"},{"line":"L00046","quote":"입금 마감을 이미 10월 17일로 공지했는데 괜찮을까요?"},{"line":"L00047","quote":"날짜는 최대한 24일 유지하려고 합니다. 입금 마감은 일단 그대로 두죠."}],"proposed_change":"certainty를 '확정'에서 잠정/추정 계열 값으로 낮추고(허용 표기 체계에 맞춰 조정), conclusion을 '진행자A가 10월 24일 날짜와 10월 17일 입금 마감을 \"최대한/일단\" 수준으로 잠정 유지하기로 했으며, 대체 장소 확보 실패 시 재검토 여지가 남아 있음'으로 수정. deadline은 '입금 마감 10월 17일(대외 공지 완료, 잠정 유지)'로 표기하고 next_check에 '장소 확정 실패 시 입금 마감 10월 17일 재공지 필요 여부'를 추가. status(해결·결정)는 이 시점 결정이 실제로 내려졌으므로 유지.","assumptions":[],"counter_evidence":[{"line":"L00048","quote":"네 알겠습니다."}],"unknowns":["장소 확정 실패 시 날짜·입금 마감 재조정 기준","입금 마감 공지 대상과 경로(청크 밖)"]},{"topic_id":"c2-T05","verdict":"accept","reason":"작년 강사 불가(L00052), 참여자D의 자원과 진행자A의 수락(L00053~L00054), 자진 설정한 보고 기한(L00055)이 모두 원문에 있습니다. 섭외 성사가 아니라 문의 담당 지정 단계임을 conclusion에서 명확히 구분했고 결과가 없음을 명시해 담당 지정과 완료를 혼동하지 않았습니다. deadline '내일(10월 7일)'도 L00035의 10월 6일 기준으로 정확합니다.","evidence":[{"line":"L00052","quote":"10월 24일은 선약이 있으시다고 하네요"},{"line":"L00054","quote":"네 부탁드립니다. 주제는 작년과 비슷하면 좋겠어요."},{"line":"L00055","quote":"오늘 저녁에 연락드려보고 내일 알려드리겠습니다."}],"proposed_change":null,"assumptions":[],"counter_evidence":[],"unknowns":["후보 강사의 신원·수락 여부","강사료 및 주제 확정 절차는 원문에 없음","10월 24일 자체가 잠정(c2-T04)이라 강사 일정 조율 기준일이 바뀔 수 있음"]},{"topic_id":"c2-T06","verdict":"accept","reason":"L00056~L00057은 담당자C의 확인 결과 공유와 개인 의견이며, 이에 대한 다른 참여자의 응답은 없습니다(L00058은 일반 인사). '정보공유' 분류와 '별도 결정 요청이나 응답은 없음'이라는 서술이 원문과 일치합니다. deadline을 할인 적용 기한으로만 표기하고 업무 기한으로 승격하지 않은 점도 적절합니다.","evidence":[{"line":"L00056","quote":"인쇄소 할인이 이번 달 말까지라고 다시 확인했습니다."},{"line":"L00057","quote":"시간 여유는 있으니 천천히 해도 될 것 같아요."},{"line":"L00058","quote":"오늘도 수고 많으셨습니다."}],"proposed_change":null,"assumptions":[],"counter_evidence":[],"unknowns":["'천천히 해도 될 것 같다'는 제안에 대한 진행자A의 동의 여부(이 청크에서는 무응답)","'이번 달 말'이 10월 31일을 뜻하는지 원문에 명시 없음","인쇄 발주 결정 시점"]}],"missing_topics":[],"overall":"6개 안건 모두 이 청크(L00035~L00058)에 실재하며, 누락 안건은 없습니다. 인용 6건 전부 해당 줄의 부분 문자열이고 의미상으로도 결론을 뒷받침합니다. 가장 주의가 필요한 지점은 c2-T04로, 원문의 '최대한'·'일단'이라는 잠정 표현을 certainty '확정'으로 기록해 분석자 자신의 counter_evidence와 모순됩니다. 10월 24일 날짜와 이미 대외 공지된 10월 17일 입금 마감은 모두 대체 장소 확보에 종속된 조건부 유지이므로 확신도를 낮춰야 후속 청크에서 기한 변경을 번복으로 정확히 포착할 수 있습니다. c2-T03은 L00035 날짜 구분선으로 '금요일'을 2026-10-09로 특정할 수 있어 unknowns를 줄일 수 있습니다. 긍정적으로는 L00041의 '담당을 다시 정하지 않겠다'를 담당 지정으로 오독하지 않았고, 보증금 환불·시안 제출·강사 섭외를 모두 약속 단계로만 기록해 이행과 구분했으며, 미이행 항목을 성급히 '흐지부지'로 단정하지 않은 판단이 타당합니다. 사람 확인 질문 2건: (1) L00047의 잠정 유지 결정을 조직 기준상 '해결·결정'으로 볼지 '진행 중'으로 볼지, (2) L00057의 무응답 제안을 별도 추적 대상으로 올릴지 정보공유로 종결할지."}
