{"chunk":"c3","reviews":[{"topic_id":"c3-T01","verdict":"accept","reason":"원문 대조 결과 일치한다. L00060~L00061에서 조건(60명/25만 원/10월 24일)이 확인되고, L00064에서 제출 지시, L00069에서 당일 제출 약속, L00086에서 제출 완료와 승인 2~3일 소요가 명시된다. 제출은 완료됐지만 승인은 나지 않았으므로 '해결·결정'이 아닌 '진행 중'으로 둔 판단이 정확하다(제출 완료를 대관 확정으로 혼동하지 않음). owner 담당자B도 L00069·L00086 발화자와 일치하고, status 값도 허용값 범위 안이다.","evidence":[{"line":"L00069","quote":"오늘 중으로 신청서 제출하겠습니다"},{"line":"L00086","quote":"소강당 신청서 제출 완료했습니다. 승인은 2~3일 걸린다고 합니다."},{"line":"L00087","quote":"승인 나면 바로 알려주세요."}],"proposed_change":null,"assumptions":[],"counter_evidence":[],"unknowns":["L00061의 '오히려 더 저렴합니다'는 이 청크 밖 다른 후보 장소와의 비교를 전제한다. 기존 후보 장소에 가예약·문의가 있었다면 그 취소·철회가 이 청크에는 전혀 나타나지 않으므로, 앞 청크(L00059 이전)에서 기존 장소 처리 상태를 확인해야 한다.","승인 결과 통보 여부는 이후 청크 확인 필요."]},{"topic_id":"c3-T02","verdict":"accept","reason":"요청(L00065)–수락(L00066)–이행(L00068)–수령 확인(L00069)까지 한 청크 안에서 닫혔다. 담당 지정에 그치지 않고 수령 확인 발화가 있으므로 '해결·결정'이 타당하며, owner 담당자C도 실제 제공자와 일치한다.","evidence":[{"line":"L00066","quote":"제가 가지고 있어요. 스캔해서 보내드릴게요."},{"line":"L00068","quote":"등록증 스캔본 보냈습니다."},{"line":"L00069","quote":"잘 받았습니다."}],"proposed_change":null,"assumptions":[],"counter_evidence":[],"unknowns":[]},{"topic_id":"c3-T03","verdict":"accept","reason":"L00075에서 진행자A가 명시적으로 확정 결정을 내렸으므로 '해결·결정'이 맞고, 결정 이후의 이행(강사 본인에게 확정 통보)은 미확인이라는 점을 결론과 unknowns에 분리해 적어 결정/이행 구분이 지켜졌다. 이 청크 뒤에 확정을 뒤집는 발언도 없다.","evidence":[{"line":"L00074","quote":"교통비만 주면 된다고 하셨어요"},{"line":"L00075","quote":"그럼 그분으로 확정하겠습니다."},{"line":"L00076","quote":"네 그렇게 전달드리겠습니다."}],"proposed_change":null,"assumptions":[],"counter_evidence":[],"unknowns":["L00071 '어떤 분이신가요?'에 대해 L00072는 경력 설명만 하고 성함은 끝까지 답하지 않았다. 강사 신원(성함)은 이 청크 원문에 한 번도 등장하지 않으므로, 강사 특정이 필요한 후속 작업(홍보물·교통비 지급)은 c3-T04 이행에 의존한다.","교통비 금액·지급 방식은 이 청크에 없음."]},{"topic_id":"c3-T04","verdict":"accept","reason":"L00077 요청과 L00078 수락만 있고 실제 전달 보고는 없다. L00079에서 수신자인 담당자C가 '기다리고 있겠습니다'라고 한 것이 미이행의 직접 근거이므로 '담당 지정'은 정확하며 완료로 승격하지 않은 점이 옳다. deadline '오늘 중(2026-10-07)'도 L00078 문구와 L00059 날짜 헤더로 뒷받침된다.","evidence":[{"line":"L00077","quote":"강사분 성함과 소개를 홍보물에 넣어야 하니 담당자C님께 전달 부탁드려요."},{"line":"L00078","quote":"네 오늘 중으로 정리해서 드릴게요."},{"line":"L00079","quote":"기다리고 있겠습니다."}],"proposed_change":null,"assumptions":[],"counter_evidence":[],"unknowns":["같은 날 저녁(L00089·L00090)까지도 전달 완료 보고가 없다. 기한이 '오늘 중'이므로 이후 청크에서 기한 도과 여부를 확인해야 한다."]},{"topic_id":"c3-T05","verdict":"accept","reason":"L00080~L00083에서 방향(음료·빵, 알레르기 고려 종류 분리)과 파생 결정(신청서 알레르기 항목)만 있고 품목·수량·예산·담당자는 정해지지 않았다. owner를 null로 두고 '진행 중'으로 본 판단이 원문과 일치하며, 없는 담당자를 만들지 않았다.","evidence":[{"line":"L00081","quote":"작년처럼 음료랑 빵 정도면 될 것 같은데요."},{"line":"L00082","quote":"종류를 좀 나누는 게 좋겠어요"},{"line":"L00083","quote":"신청서에 알레르기 항목을 넣읍시다."}],"proposed_change":null,"assumptions":[],"counter_evidence":[],"unknowns":["L00080의 '50명 기준'과 L00060의 수용 60명 사이 인원 기준 차이가 조정된 적 없음 — 이후 청크 확인 필요.","간식 담당자·예산 미정."]},{"topic_id":"c3-T06","verdict":"accept","reason":"질문(L00084)–자원(L00085)–제작 완료 보고(L00089)–제3자 확인(L00090)까지 같은 날 안에 닫혔고, 알레르기 항목 반영까지 확인된다. '해결·결정'이 타당하다. 다만 L00085의 '링크 공유'는 본문상 링크 첨부 문구 없이 L00089 완료 보고로 이어지는데, L00090의 확인 발화로 공유 자체는 뒷받침되므로 결론을 수정할 정도는 아니다.","evidence":[{"line":"L00085","quote":"제가 만들겠습니다. 오늘 중으로 링크 공유할게요."},{"line":"L00089","quote":"신청 폼 만들었습니다. 알레르기 항목 넣었어요."},{"line":"L00090","quote":"확인했습니다. 잘 만들어졌네요."}],"proposed_change":null,"assumptions":[],"counter_evidence":[{"line":"L00089","quote":"신청 폼 만들었습니다."}],"unknowns":["신청 폼 링크가 동아리 전체(단톡방 밖 공지 등)에 실제 배포됐는지, 접수 개시 시점은 이 청크에 없음."]}],"missing_topics":[],"overall":"6개 안건 모두 원문과 대조해 accept. 이 청크에서 가장 혼동하기 쉬운 두 지점(신청서 '제출 완료'를 대관 확정으로 승격, 강사 자료 '담당 지정'을 전달 완료로 승격)을 분석자가 모두 피했고, status 값도 허용값 범위를 벗어나지 않았다. 누락 안건은 없다. 다만 청크 밖 확인이 필요한 항목이 세 가지다. (1) L00061 '오히려 더 저렴합니다'가 전제하는 기존 후보 장소의 예약·문의 취소 처리가 이 청크에 전혀 없다 — 앞 청크 확인 필요. (2) 강사 성함이 원문에 한 번도 나오지 않아(L00071 질문은 L00072에서 성함 없이 답변됨) c3-T04 이행 전까지 강사 특정이 불가능하다. (3) L00080의 '50명 기준'과 L00060의 수용 60명 간 인원 기준이 조정된 적 없다. 사람 확인 질문: 기존 후보 장소에 가예약이 있었다면 취소 통보가 별도 안건으로 필요한지 확인 바랍니다."}
